{
  "schema_version": "1.2",
  "run_id": "2026-06-06-0351-hourly-autopilot",
  "created_at": "2026-06-05T18:55:30Z",
  "paper": true,
  "mode": "submit",
  "risk_policy_version": "medium-risk-v1.1",
  "recommendation_policy_sha": "de9b53371f5b8e4b65aa39d5f196b6cf7473efeec465af920da02cac664760e6",
  "manifest_path": "wiki/evidence-store/run-manifests/2026-06-06-0351-hourly-autopilot.json",
  "account": {
    "portfolio_value": 98082.65,
    "cash": 30159.69,
    "buying_power": 245172.4,
    "currency": "USD",
    "daily_realized_loss": 0.0
  },
  "market": {
    "is_open": true,
    "checked_at": "2026-06-05T18:54:03Z",
    "next_open": "2026-06-08T09:30:00-04:00",
    "next_close": "2026-06-05T16:00:00-04:00",
    "session": "regular"
  },
  "positions": [
    {
      "symbol": "AAPL",
      "theme": "mega_cap_tech",
      "factor": "growth_quality",
      "volatility_bucket": "medium",
      "speculative_flag": false,
      "liquidity_bucket": "mega",
      "source_confidence": "high",
      "correlated_cluster": "mega_cap_tech",
      "qty": 3.0,
      "market_value": 930.36
    },
    {
      "symbol": "ADBE",
      "theme": "software",
      "factor": "growth_quality",
      "volatility_bucket": "medium",
      "speculative_flag": false,
      "liquidity_bucket": "large",
      "source_confidence": "high",
      "correlated_cluster": "software_cloud",
      "qty": 1.0,
      "market_value": 251.67
    },
    {
      "symbol": "AMD",
      "theme": "ai_semiconductor",
      "factor": "ai_semiconductor",
      "volatility_bucket": "high",
      "speculative_flag": false,
      "liquidity_bucket": "mega",
      "source_confidence": "high",
      "correlated_cluster": "ai_semiconductor_complex",
      "qty": 14.0,
      "market_value": 6532.82
    },
    {
      "symbol": "AMZN",
      "theme": "mega_cap_tech",
      "factor": "growth_quality",
      "volatility_bucket": "medium",
      "speculative_flag": false,
      "liquidity_bucket": "mega",
      "source_confidence": "high",
      "correlated_cluster": "mega_cap_tech",
      "qty": 4.0,
      "market_value": 992.64
    },
    {
      "symbol": "AVGO",
      "theme": "ai_semiconductor",
      "factor": "ai_semiconductor",
      "volatility_bucket": "medium",
      "speculative_flag": false,
      "liquidity_bucket": "mega",
      "source_confidence": "high",
      "correlated_cluster": "ai_semiconductor_complex",
      "qty": 12.0,
      "market_value": 4648.44
    },
    {
      "symbol": "BAC",
      "theme": "financials",
      "factor": "bank_rate_sensitive",
      "volatility_bucket": "medium",
      "speculative_flag": false,
      "liquidity_bucket": "mega",
      "source_confidence": "high",
      "correlated_cluster": "financials",
      "qty": 4.0,
      "market_value": 215.14
    },
    {
      "symbol": "COP",
      "theme": "energy",
      "factor": "commodity_cyclical",
      "volatility_bucket": "medium",
      "speculative_flag": false,
      "liquidity_bucket": "large",
      "source_confidence": "high",
      "correlated_cluster": "energy_commodity",
      "qty": 3.0,
      "market_value": 352.92
    },
    {
      "symbol": "CVX",
      "theme": "energy",
      "factor": "commodity_cyclical",
      "volatility_bucket": "medium",
      "speculative_flag": false,
      "liquidity_bucket": "large",
      "source_confidence": "high",
      "correlated_cluster": "energy_commodity",
      "qty": 1.0,
      "market_value": 188.05
    },
    {
      "symbol": "ETN",
      "theme": "power_infrastructure",
      "factor": "industrial_power",
      "volatility_bucket": "medium",
      "speculative_flag": false,
      "liquidity_bucket": "large",
      "source_confidence": "high",
      "correlated_cluster": "electrification_infrastructure",
      "qty": 15.0,
      "market_value": 5907.6
    },
    {
      "symbol": "FCX",
      "theme": "materials_mining",
      "factor": "commodity_cyclical",
      "volatility_bucket": "high",
      "speculative_flag": false,
      "liquidity_bucket": "large",
      "source_confidence": "high",
      "correlated_cluster": "energy_commodity",
      "qty": 3.0,
      "market_value": 187.62
    },
    {
      "symbol": "GOOGL",
      "theme": "mega_cap_tech",
      "factor": "growth_quality",
      "volatility_bucket": "medium",
      "speculative_flag": false,
      "liquidity_bucket": "mega",
      "source_confidence": "high",
      "correlated_cluster": "mega_cap_tech",
      "qty": 3.0,
      "market_value": 1104.27
    },
    {
      "symbol": "INTC",
      "theme": "ai_semiconductor",
      "factor": "ai_semiconductor",
      "volatility_bucket": "high",
      "speculative_flag": false,
      "liquidity_bucket": "large",
      "source_confidence": "high",
      "correlated_cluster": "ai_semiconductor_complex",
      "qty": 1.0,
      "market_value": 99.86
    },
    {
      "symbol": "IONQ",
      "theme": "quantum_speculative",
      "factor": "speculative_growth",
      "volatility_bucket": "high",
      "speculative_flag": true,
      "liquidity_bucket": "medium",
      "source_confidence": "medium",
      "correlated_cluster": "quantum_speculative",
      "qty": 45.0,
      "market_value": 2527.2
    },
    {
      "symbol": "LLY",
      "theme": "healthcare_pharma",
      "factor": "healthcare_growth",
      "volatility_bucket": "medium",
      "speculative_flag": false,
      "liquidity_bucket": "mega",
      "source_confidence": "high",
      "correlated_cluster": "healthcare",
      "qty": 1.0,
      "market_value": 1141.33
    },
    {
      "symbol": "LRCX",
      "theme": "semicap_equipment",
      "factor": "ai_semiconductor",
      "volatility_bucket": "medium",
      "speculative_flag": false,
      "liquidity_bucket": "large",
      "source_confidence": "high",
      "correlated_cluster": "ai_semiconductor_complex",
      "qty": 20.0,
      "market_value": 6121.8
    },
    {
      "symbol": "MSFT",
      "theme": "mega_cap_tech",
      "factor": "growth_quality",
      "volatility_bucket": "medium",
      "speculative_flag": false,
      "liquidity_bucket": "mega",
      "source_confidence": "high",
      "correlated_cluster": "mega_cap_tech",
      "qty": 1.0,
      "market_value": 417.13
    },
    {
      "symbol": "NEE",
      "theme": "utilities_power",
      "factor": "defensive_yield",
      "volatility_bucket": "medium",
      "speculative_flag": false,
      "liquidity_bucket": "large",
      "source_confidence": "high",
      "correlated_cluster": "utilities",
      "qty": 4.0,
      "market_value": 343.4
    },
    {
      "symbol": "NKE",
      "theme": "consumer_cyclical",
      "factor": "consumer_rate_sensitive",
      "volatility_bucket": "medium",
      "speculative_flag": false,
      "liquidity_bucket": "large",
      "source_confidence": "high",
      "correlated_cluster": "consumer_discretionary",
      "qty": 4.0,
      "market_value": 172.02
    },
    {
      "symbol": "NOK",
      "theme": "networking",
      "factor": "international_adr",
      "volatility_bucket": "high",
      "speculative_flag": false,
      "liquidity_bucket": "medium",
      "source_confidence": "medium",
      "correlated_cluster": "communications_infrastructure",
      "qty": 402.0,
      "market_value": 5656.14
    },
    {
      "symbol": "NVDA",
      "theme": "ai_semiconductor",
      "factor": "ai_semiconductor",
      "volatility_bucket": "high",
      "speculative_flag": false,
      "liquidity_bucket": "mega",
      "source_confidence": "high",
      "correlated_cluster": "ai_semiconductor_complex",
      "qty": 38.0,
      "market_value": 7796.27
    },
    {
      "symbol": "PFE",
      "theme": "healthcare_pharma",
      "factor": "defensive_healthcare",
      "volatility_bucket": "low",
      "speculative_flag": false,
      "liquidity_bucket": "large",
      "source_confidence": "high",
      "correlated_cluster": "healthcare",
      "qty": 4.0,
      "market_value": 104.38
    },
    {
      "symbol": "PLTR",
      "theme": "ai_software",
      "factor": "high_beta_growth",
      "volatility_bucket": "high",
      "speculative_flag": true,
      "liquidity_bucket": "large",
      "source_confidence": "medium",
      "correlated_cluster": "speculative_growth",
      "qty": 3.0,
      "market_value": 404.445
    },
    {
      "symbol": "QQQ",
      "theme": "broad_market",
      "factor": "growth_index",
      "volatility_bucket": "medium",
      "speculative_flag": false,
      "liquidity_bucket": "mega",
      "source_confidence": "high",
      "correlated_cluster": "broad_index",
      "qty": 3.0,
      "market_value": 2125.164
    },
    {
      "symbol": "RGTI",
      "theme": "quantum_speculative",
      "factor": "speculative_growth",
      "volatility_bucket": "high",
      "speculative_flag": true,
      "liquidity_bucket": "medium",
      "source_confidence": "medium",
      "correlated_cluster": "quantum_speculative",
      "qty": 120.0,
      "market_value": 2427.6
    },
    {
      "symbol": "SLB",
      "theme": "energy_services",
      "factor": "commodity_cyclical",
      "volatility_bucket": "high",
      "speculative_flag": false,
      "liquidity_bucket": "large",
      "source_confidence": "high",
      "correlated_cluster": "energy_commodity",
      "qty": 4.0,
      "market_value": 219.68
    },
    {
      "symbol": "SO",
      "theme": "utilities_power",
      "factor": "defensive_yield",
      "volatility_bucket": "low",
      "speculative_flag": false,
      "liquidity_bucket": "large",
      "source_confidence": "high",
      "correlated_cluster": "utilities",
      "qty": 5.0,
      "market_value": 467.25
    },
    {
      "symbol": "SPY",
      "theme": "broad_market",
      "factor": "broad_index",
      "volatility_bucket": "low",
      "speculative_flag": false,
      "liquidity_bucket": "mega",
      "source_confidence": "high",
      "correlated_cluster": "broad_index",
      "qty": 2.0,
      "market_value": 1478.58
    },
    {